<?xml version="1.0" encoding="UTF-8"?>
<xs:schema xmlns:xs="http://www.w3.org/2001/XMLSchema">
    <xs:element name="police">
        <xs:complexType>
            <xs:sequence>
                <xs:element name="officer" maxOccurs="unbounded">
                    <xs:complexType>
                        <xs:sequence>
                            <xs:element name="officerid" type="xs:string"/>
                            <xs:element name="name" type="xs:string"/>
                            <xs:element name="designation" type="xs:string"/>
                            <xs:element name="station" type="xs:string"/>
                            <xs:element name="salary" type="xs:integer"/>
                        </xs:sequence>
                    </xs:complexType>
                </xs:element>
            </xs:sequence>
        </xs:complexType>
    </xs:element>
</xs:schema>
